### ISSUE TITLE
sngrep 1.4.8 (from brew) on MacOS 11.2.3

### ISSUE THREAD

**Issue by michbsd** [irontec/sngrep#354]
It looks like sngrep is not grabbing TCP traffic - I have several clients running (Wireshark, tshark and termshark) all pick up the SIP/TCP traffic. Nothing at all captures in sngrep. 

If I send SIP/UDP traffic - it pops up in sngrep as well. 

Any ideas?

**Comment by Kaian** [comment]
Hi @michbsd 

Have you tried to open one of those pcap files captured from thark with sngrep? Still doesn't display TCP/SIP packets?
Feel free to send me a pcap file with TCP/SIP packets so I can debug where the problem is.

Thanks!

**Comment by michbsd** [comment]
Thanks for the quick reply.
I did some more digging and it seems to be the auth header that breaks it. 

captured in sngrep: 

![tcp_working](https://user-images.githubusercontent.com/8202334/114843103-c431e380-9dd9-11eb-9aa9-93533cbc916b.png)

Not captured in sngrep:

![tcp_not_working](https://user-images.githubusercontent.com/8202334/114843154-d3189600-9dd9-11eb-8d3b-b4659165267e.png)

As you can see sngrep only shows first message:

![sngrep capature tcp](https://user-images.githubusercontent.com/8202334/114843704-618d1780-9dda-11eb-9ac4-b31a39e57788.png)

**Comment by Kaian** [comment]
That's stange because that header is not taken into account while SIP parsing

Are all SIP messages in different packets? maybe some message are split in multiple packets or a packet contains more than one SIP message?

**Comment by michbsd** [comment]
Don't think so. Just made another - test only message without auth header is displayed in sngrep. 

`tshark -r tcp_issue.pcapng
    1   0.000000 192.168.5.64 → 185.xx.xx.xx SIP 59985 5060 611 2051933705 Request: REGISTER sip:REDACTED  (1 binding) |
    2   0.019887 185.xx.xx.xx → 192.168.5.64 SIP 5060 59985 704 2051933705 Status: 401 Unauthorized |
    3   0.022527 192.168.5.64 → 185.xx.xx.xx SIP 59985 5060 884 2051933705 Request: REGISTER sip:REDACTED  (1 binding) |
    4   0.039308 185.xx.xx.xx → 192.168.5.64 SIP 5060 59985 704 2051933705 Status: 401 Unauthorized |
    5   0.040886 192.168.5.64 → 185.xx.xx.xx SIP 59985 5060 884 2051933705 Request: REGISTER sip:REDACTED  (1 binding) |
    6   0.111310 185.xx.xx.xx→ 192.168.5.64 SIP 5060 59985 717 2051933705 Status: 200 OK  (1 binding) |`

`tcpdump -r tcp_issue.pcapng
reading from PCAP-NG file tcp_issue.pcapng
15:34:27.984716 IP 192.168.5.64.59985 > 185.xx.xx.xx.sip: Flags [P.], seq 3842785723:3842786268, ack 2413243377, win 2064, options [nop,nop,TS val 1001547271 ecr 1732672493], length 545
15:34:28.004603 IP 185.xx.xx.xx.sip > 192.168.5.64.59985: Flags [P.], seq 1:639, ack 545, win 114, options [nop,nop,TS val 1732672527 ecr 1001547271], length 638
15:34:28.007243 IP 192.168.5.64.59985 > 185.xx.xx.xxsip: Flags [P.], seq 545:1363, ack 639, win 2054, options [nop,nop,TS val 1001547292 ecr 1732672527], length 818
15:34:28.024024 IP 185.xx.xx.xx.sip > 192.168.5.64.59985: Flags [P.], seq 639:1277, ack 1363, win 127, options [nop,nop,TS val 1732672547 ecr 1001547292], length 638
15:34:28.025602 IP 192.168.5.64.59985 > 185.xx.xx.xx.sip: Flags [P.], seq 1363:2181, ack 1277, win 2048, options [nop,nop,TS val 1001547308 ecr 1732672547], length 818
15:34:28.096026 IP 185.xx.xx.xx.sip > 192.168.5.64.59985: Flags [P.], seq 1277:1928, ack 2181, win 140, options [nop,nop,TS val 1732672620 ecr 1001547308], length 651`


and in sngrep:

![tcp_issue](https://user-images.githubusercontent.com/8202334/114878881-fa368e00-9e00-11eb-9227-c3bf34358c8d.png)

**Comment by Kaian** [comment]
Can you provide a test pcap so I can debug this issue? You can send it to the email in my profile.

Thanks!

**Comment by michbsd** [comment]
I've emailed you an example trace

**Comment by michbsd** [comment]
Hey there - did you manage to progress on this?

**Comment by Kaian** [comment]
Hey! 

As commeted in the email, this problem can not be reproduced in other enviroments apart from MacOS and I have not access to a MacOS right now (and due to current world status, it seems I won't have it in the following months).

I have tested the same PCAP under Debian and Gentoo builds and seems ok, displaying all the packets.

Have you tried to compile from sources? Maybe we can add some debugging lines.

Regards

**Comment by michbsd** [comment]
Hi, 

Yes, I've compiled from src - and I tried on a couple of different MacOS systems/versions. Same behavior on all, so 100% reproducible.

Sure - I can compile a version with some DEBUG - let me know what you would like.

**Comment by Kaian** [comment]
I have created a new branch called macos-debug with some printf messages so we can guess if the problem is in capture layer (packets are not being properly parsed) or storage (messages are being discarded). 

This is a basic approach and more debugging lines may be required in the future.
 I have tested with the pcap you sent me with:

    # src/sngrep -Nq -I tcp-issue_new.pcapng

I hope this will add some light to this issue.

Thanks for your time @michbsd !

**Comment by michbsd** [comment]
I've emailed you the result.

**Comment by michbsd** [comment]
👍🏻 - looks like we can close this one. Thanks

**Comment by Kaian** [comment]
Finally, lots of debug lines later, we found an array while validating TCP packets that was overflowing, overwritting packet payload. Above commit should fix the problem.

Thanks a lot @michbsd for your time and patience!

**Comment by michbsd** [comment]
when do you expect to push a new release?

**Comment by Kaian** [comment]
There are now a couple of commits for 1.4.9, so I will wait a bit more for new fixes and release a new version at some point in May.
