### ISSUE TITLE
TLS not captured with FreeBSD

### ISSUE THREAD

**Issue by 0x6e6562** [irontec/sngrep#118]
I've compiled sngrep with openssl:

```
# ldd sngrep
sngrep:
	libcrypto.so.7 => /lib/libcrypto.so.7 (0x800840000)
	libssl.so.7 => /usr/lib/libssl.so.7 (0x800c34000)
	libmenu.so.5 => /usr/lib/libmenu.so.5 (0x800ea0000)
	libform.so.5 => /usr/lib/libform.so.5 (0x8010a7000)
	libpanel.so.5 => /usr/lib/libpanel.so.5 (0x8012b6000)
	libncurses.so.8 => /lib/libncurses.so.8 (0x8014b9000)
	libpcap.so.8 => /lib/libpcap.so.8 (0x801706000)
	libthr.so.3 => /lib/libthr.so.3 (0x80194b000)
	libc.so.7 => /lib/libc.so.7 (0x801b6f000)
```

and it seems to work fine for UDP capture.

However, when I try to capture TLS:

```
sngrep -d em0 -k selfsigned.key port 5061
```

nothing is captured.

I've looked to see whether a SIP UA is actually trying to send messages via TLS to port 5061 on the same host:

```
# tcpdump -i em0 -n port 5061
tcpdump: verbose output suppressed, use -v or -vv for full protocol decode
listening on em0, link-type EN10MB (Ethernet), capture size 65535 bytes
18:19:22.285547 IP 172.16.40.1.51842 > 172.16.40.202.5061: Flags [P.], seq 97120391:97120993, ack 383557354, win 4096, options [nop,nop,TS val 1624197872 ecr 3941048341], length 602
18:19:22.385693 IP 172.16.40.202.5061 > 172.16.40.1.51842: Flags [.], ack 602, win 1040, options [nop,nop,TS val 3941079390 ecr 1624197872], length 0
18:19:22.386376 IP 172.16.40.1.51842 > 172.16.40.202.5061: Flags [P.], seq 602:1348, ack 1, win 4096, options [nop,nop,TS val 1624197971 ecr 3941079390], length 746
18:19:22.488070 IP 172.16.40.202.5061 > 172.16.40.1.51842: Flags [.], ack 1348, win 1040, options [nop,nop,TS val 3941079493 ecr 1624197971], length 0
18:19:22.741953 IP 172.16.40.1.51842 > 172.16.40.202.5061: Flags [P.], seq 1348:2094, ack 1, win 4096, options [nop,nop,TS val 1624198324 ecr 3941079493], length 746
18:19:22.842629 IP 172.16.40.202.5061 > 172.16.40.1.51842: Flags [.], ack 2094, win 1040, options [nop,nop,TS val 3941079847 ecr 1624198324], length 0
18:19:44.028181 IP 172.16.40.1.51842 > 172.16.40.202.5061: Flags [P.], seq 2094:2168, ack 1, win 4096, options [nop,nop,TS val 1624219539 ecr 3941079847], length 74
18:19:44.028412 IP 172.16.40.202.5061 > 172.16.40.1.51842: Flags [P.], seq 1:38, ack 2168, win 1040, options [nop,nop,TS val 3941101033 ecr 1624219539], length 37
18:19:44.028488 IP 172.16.40.1.51842 > 172.16.40.202.5061: Flags [.], ack 38, win 4094, options [nop,nop,TS val 1624219539 ecr 3941101033], length 0
```

Am I missing something here?

**Comment by Kaian** [comment]
Hi @0x6e6562 

Currently only two ciphers are supported. (check #59)
Also, sngrep must capture the initial ssl handsake in order to get the ssl session data.

You can check the used cipher in ServerHello message using ssldump, wireshark or other tool.

Thanks for reporting!

**Comment by 0x6e6562** [comment]
I guess you are right - the server seems to sending an unknown value for the ServerHello:

```
New TCP connection #1: 172.16.40.1(54467) <-> 172.16.40.202(5061)
1 1  0.0002 (0.0002)  C>S  Handshake
      ClientHello
        Version 3.1
        cipher suites
        Unknown value 0xc014
        Unknown value 0x39
        Unknown value 0x35
        Unknown value 0x38
        Unknown value 0xc013
        Unknown value 0x33
        Unknown value 0x2f
        Unknown value 0x32
        Unknown value 0xc012
        TLS_DHE_RSA_WITH_3DES_EDE_CBC_SHA
        TLS_RSA_WITH_3DES_EDE_CBC_SHA
        TLS_DHE_DSS_WITH_3DES_EDE_CBC_SHA
        Unknown value 0xc011
        TLS_RSA_WITH_RC4_128_SHA
        TLS_RSA_WITH_RC4_128_MD5
        TLS_DHE_RSA_WITH_DES_CBC_SHA
        TLS_RSA_WITH_DES_CBC_SHA
        TLS_DHE_RSA_EXPORT_WITH_DES40_CBC_SHA
        TLS_RSA_EXPORT_WITH_DES40_CBC_SHA
        TLS_DHE_DSS_WITH_DES_CBC_SHA
        TLS_DHE_DSS_EXPORT_WITH_DES40_CBC_SHA
        TLS_RSA_EXPORT_WITH_RC4_40_MD5
        Unknown value 0xff
        compression methods
                  NULL
1 2  0.0005 (0.0002)  S>C  Handshake
      ServerHello
        Version 3.1
        session_id[0]=

        cipherSuite         Unknown value 0x35
        compressionMethod                   NULL
1 3  0.0005 (0.0000)  S>C  Handshake
      Certificate
1 4  0.0005 (0.0000)  S>C  Handshake
      ServerHelloDone
1 5  0.0018 (0.0012)  C>S  Handshake
      ClientKeyExchange
1 6  0.0018 (0.0000)  C>S  ChangeCipherSpec
1 7  0.0018 (0.0000)  C>S  Handshake
1 8  0.0039 (0.0020)  S>C  Handshake
```

**Comment by Kaian** [comment]
Ummm, in fact 0x35 should be CipherSuite TLS_RSA_WITH_AES_256_CBC_SHA that can be decrypted with the private key :thought_balloon: 

If you can provide a temporal key with a pcap capture I can debug why nothing is appearing.
We rarely use sngrep with TLS so my only tests are done with the pcap you provide when reporting this issues :)

Thanks!

**Comment by 0x6e6562** [comment]
Hold press, I think there was a bit of PEBCAK in my setup.

After configuring the server to only offer TLS_RSA_WITH_AES_256_CBC_SHA, sngrep is capturing the messages via TLS.

However, I think that there must have been something else in the pipeline that was killing the vibe, so I think the best thing to do now is to close this issue, as sngrep appears to be working properly (maybe there is some latency in my setup).

Many thanks for such a prompt response :-)

**Comment by Kaian** [comment]
You welcome, feel free to drop a line at irc channel if you have any other trouble ;-)
